{
  "conversation_id": "00000000-0000-4000-8000-000000000001",
  "status": "SUCCESS",
  "response": "FAKE_OK\n",
  "duration_seconds": 0.0,
  "num_turns": 1,
  "usage": {
    "input_tokens": 0,
    "output_tokens": 0,
    "thinking_tokens": 0,
    "cache_read_tokens": 0,
    "total_tokens": 0
  }
}
